tmdb_id,title,overview,genres,popularity,vote_average,vote_count,language,release_date
1306368,The Rip,"Trust frays when a team of Miami cops discovers millions in cash inside a run-down stash house, calling everyone — and everything — into question.","['Action', 'Thriller', 'Crime']",566.971,7.11,495,en,2026-01-13
1242898,Predator: Badlands,"Cast out from his clan, a young Predator finds an unlikely ally in a damaged android and embarks on a treacherous journey in search of the ultimate adversary.","['Action', 'Science Fiction', 'Adventure']",320.969,7.799,1540,en,2025-11-05
83533,Avatar: Fire and Ash,"In the wake of the devastating war against the RDA and the loss of their eldest son, Jake Sully and Neytiri face a new threat on Pandora: the Ash People, a violent and power-hungry Na'vi tribe led by the ruthless Varang. Jake's family must fight for their survival and the future of Pandora in a conflict that pushes them to their emotional and physical limits.","['Science Fiction', 'Adventure', 'Fantasy']",264.0534,7.346,1521,en,2025-12-17
1242501,Icefall,"A young Indigenous game warden arrests an infamous poacher only to discover that the poacher knows the location of a plane carrying millions of dollars that has crashed in a frozen lake. When a group of criminals and dirty cops are alerted to the poacher’s whereabouts, the warden and the poacher team up to fight back and escape across the treacherous lake before the ice melts.","['Action', 'Crime', 'Thriller']",213.1218,6.489,87,en,2025-10-16
1043197,Dust Bunny,"Ten-year-old Aurora asks her hitman neighbor to kill the monster under her bed that she claims ate her family. To protect her, he must battle an onslaught of assassins while accepting that some monsters are real.","['Action', 'Fantasy', 'Thriller']",302.2415,6.871,68,en,2025-12-11
1084242,Zootopia 2,"After cracking the biggest case in Zootopia's history, rookie cops Judy Hopps and Nick Wilde find themselves on the twisting trail of a great mystery when Gary De'Snake arrives and turns the animal metropolis upside down. To crack the case, Judy and Nick must go undercover to unexpected new parts of town, where their growing partnership is tested like never before.","['Animation', 'Comedy', 'Adventure', 'Family', 'Mystery']",187.146,7.594,1123,en,2025-11-26
1368166,The Housemaid,"Trying to escape her past, Millie Calloway accepts a job as a live-in housemaid for the wealthy Nina and Andrew Winchester. But what begins as a dream job quickly unravels into something far more dangerous—a sexy, seductive game of secrets, scandal, and power.","['Mystery', 'Thriller']",187.8712,7.198,446,en,2025-12-18
1252037,The Tank,"A German Tiger tank crew is sent on a dangerous mission to rescue the missing officer Paul von Hardenburg from a top-secret bunker behind enemy lines. As they make their way through the lethal no-man's land, they must confront not only the enemy, but also their own fears and inner demons. Fueled by the Wehrmacht's methamphetamine, their mission increasingly becomes a journey into the heart of darkness.","['War', 'Action', 'Drama']",152.7376,7.03,248,de,2025-09-18
62029,Bingo Bongo,"The ape-man, found somewhere in the jungles of Congo, transferred to Milan and named Bingo Bongo. The only one who believes in the human qualities of him is Laura, a woman anthropologist , so their affection for each other even grows to love.",['Comedy'],107.2173,5.702,168,it,1982-12-23
755898,War of the Worlds,"Will Radford is a top analyst for Homeland Security who tracks potential threats through a mass surveillance program, until one day an attack by an unknown entity leads him to question whether the government is hiding something from him... and from the rest of the world.","['Science Fiction', 'Thriller']",119.8304,4.224,850,en,2025-07-29
1311031,Demon Slayer: Kimetsu no Yaiba Infinity Castle,"The Demon Slayer Corps are drawn into the Infinity Castle, where Tanjiro, Nezuko, and the Hashira face terrifying Upper Rank demons in a desperate fight as the final battle against Muzan Kibutsuji begins.","['Animation', 'Action', 'Fantasy']",115.9391,7.655,667,ja,2025-07-18
1272837,28 Years Later: The Bone Temple,Dr. Kelson finds himself in a shocking new relationship - with consequences that could change the world as they know it - and Spike's encounter with Jimmy Crystal becomes a nightmare he can't escape.,"['Horror', 'Thriller', 'Science Fiction']",115.7367,7.173,168,en,2026-01-14
628847,Trap House,"An undercover DEA agent and his partner embark on a game of cat and mouse with an audacious, and surprising group of thieves - their own rebellious teenagers, who have begun robbing from a dangerous cartel, using their parents' tactics and top-secret intel to do it.","['Action', 'Crime', 'Thriller']",100.9872,6.575,166,en,2025-11-14
1511417,Bāhubali: The Epic,"When a mysterious child is found by a tribal couple near a roaring waterfall, they raise him as their own. As he grows, Sivudu is drawn to the world beyond the cliffs, where he discovers the ancient kingdom of Mahishmati, ruled by a cruel tyrant, haunted by rebellion, and bound to his past. What begins as a quest for love soon unravels a legacy of betrayal, sacrifice, and a forgotten prince.","['Action', 'Drama']",101.2709,5.87,23,te,2025-10-29
1419406,The Shadow's Edge,Macau Police brings the tracking expert police officer out of retirement to help catch a dangerous group of professional thieves.,"['Action', 'Crime', 'Drama', 'Thriller']",102.2578,7.178,307,zh,2025-08-16
1131759,Omniscient Reader: The Prophecy,"Kim Dok-ja, an ordinary man in his 20s, is the only reader of an obscure web novel titled ""Three Ways to Survive the Apocalypse"". After having read the last chapter, the novel suddenly becomes reality, and its omnipotent hero Yu Jung-hyeok appears before Kim. As the only person who knows how to survive in this world, Kim and his companions strive to save the world by writing his own, new ending.","['Action', 'Adventure', 'Fantasy']",94.2501,6.62,46,ko,2025-07-23
1208348,Rental Family,"An American actor in Tokyo struggles to find purpose until he lands an unusual gig: working for a Japanese 'rental family' agency, playing stand-in roles for strangers. As he immerses himself in his clients' worlds, he begins to form genuine bonds that blur the lines between performance and reality.","['Comedy', 'Drama']",83.2296,7.811,204,en,2025-11-20
425274,Now You See Me: Now You Don't,"The original Four Horsemen reunite with a new generation of illusionists to take on powerful diamond heiress Veronika Vanderberg, who leads a criminal empire built on money laundering and trafficking. The new and old magicians must overcome their differences to work together on their most ambitious heist yet.","['Thriller', 'Crime', 'Mystery']",93.8551,6.6,913,en,2025-11-12
1255674,Crazy Old Lady,"Pedro receives a desperate message from an ex-girlfriend asking him to look after her senile mother, Alicia. What seems like a simple mission soon becomes his worst nightmare. Pedro needs to escape; but Alicia won’t let him...","['Horror', 'Thriller', 'Comedy']",85.9019,5.643,14,es,2025-10-10
1512623,Risqué,"Fired from a strip club, a vengeful dancer masterminds a high-stakes heist with fellow strippers to take down the corrupt boss and the men who underestimate them.","['Action', 'Crime', 'Thriller']",86.203,7.521,47,en,2025-08-01
1228246,Five Nights at Freddy's 2,"One year since the supernatural nightmare at Freddy Fazbear's Pizza, the stories about what transpired there have been twisted into a campy local legend, inspiring the town's first ever Fazfest. With the truth kept from her, Abby sneaks out to reconnect with Freddy, Bonnie, Chica, and Foxy, setting into motion a terrifying series of events that will reveal dark secrets about the real origin of Freddy's, and unleash a decades-hidden horror.","['Horror', 'Thriller']",76.8746,6.765,633,en,2025-12-03
1412598,Killer Whale,Follows best friends Maddie and Trish as they find themselves trapped in a remote lagoon with the dangerous killer whale named Ceto.,"['Thriller', 'Horror', 'Action', 'Mystery', 'Science Fiction']",122.2905,5.962,26,en,2026-01-16
1491902,Bang,"Follows a ruthless hitman who, after narrowly escaping a fatal attempt on his life, betrays his gang in an effort to find forgiveness but ends up becoming a target himself.","['Action', 'Thriller']",77.4362,6.564,47,th,2025-07-11
1181765,School of Magical Animals 3,"Ida wants to perform with her class at the annual Forest Day to campaign for the protection of the local forest. Even Helene is there, as she hopes to use the footage of the performance to build up her influencer channel. What nobody knows is that Helene's family is on the verge of bankruptcy and Helene urgently needs followers to avert the threat of bankruptcy. Helene is also under pressure from the high expectations of her magical animal, Karajan the cat from Paris, who imagines a life of pure luxury.","['Family', 'Fantasy', 'Comedy']",69.2375,6.2,23,de,2024-09-26
982843,The Great Flood,"When a raging flood traps a researcher and her young son, a call to a crucial mission puts their escape — and the future of humanity — on the line.","['Science Fiction', 'Adventure', 'Drama']",77.5111,6.03,497,ko,2025-09-18
1034716,People We Meet on Vacation,"Poppy's a free spirit. Alex loves a plan. After years of summer vacations, these polar-opposite pals wonder if they could be a perfect romantic match.","['Romance', 'Comedy', 'Drama']",63.7446,7.079,292,en,2026-01-06
1301122,Nazi Supersoldier,"A group of journalism students ventures into a remote forest and awakens a long-frozen World War II experiment a superhuman Nazi soldier. Hunted through cursed woods where trust crumbles and survival is slim, they soon learn that some sins demand blood.","['Horror', 'Action', 'Science Fiction']",65.2535,5.167,18,en,2024-10-13
7451,xXx,"Xander Cage is your standard adrenaline junkie with no fear and a lousy attitude. When the US Government ""recruits"" him to go on a mission, he's not exactly thrilled. His mission: to gather information on an organization that may just be planning the destruction of the world, led by the nihilistic Yorgi.","['Action', 'Adventure', 'Thriller', 'Crime', 'Drama']",79.3627,5.983,4740,en,2002-08-09
1282440,Happy Patel: Khatarnak Jasoos,"Happy Patel, a chronically unsuccessful MI7 operative, is finally assigned a mission in Goa, where he uncovers his Indian roots and must rescue a high-profile scientist from crime lord Mama. Unaware of his Indian heritage and armed with a comically British accent, Happy’s blunders trigger a string of chaotic mishaps that could lead him to expose a criminal network.","['Comedy', 'Action', 'Romance']",54.9669,8.2,6,hi,2026-01-16
1054867,One Battle After Another,"Washed-up revolutionary Bob exists in a state of stoned paranoia, surviving off-grid with his spirited, self-reliant daughter, Willa. When his evil nemesis resurfaces after 16 years and she goes missing, the former radical scrambles to find her, father and daughter both battling the consequences of his past.","['Thriller', 'Crime', 'Action']",61.1633,7.4,2493,en,2025-09-23
1137179,Yadang: The Snitch,"Navigating both the criminal underworld and law enforcement agencies, professional snitches called ""yadang"" provide covert information about the drug world to prosecutors and police. When a drug bust at a party attended by high-profile second-generation VIPs entangles those involved into a dangerous conspiracy, a seasoned yadang must do everything in his power not just to make it out on top, but alive.","['Crime', 'Action', 'Comedy', 'Drama', 'Thriller']",67.9816,7.0,33,ko,2025-04-16
1439112,Muzzle: City of Wolves,"LAPD officer Jake Rosser endeavors to lead a peaceful life with his family and retired K-9 officer, Socks. However, tranquility dissolves into chaos when a gang targets them in a brutal attack. Alongside his new K-9 partner Argos, Jake launches into a relentless pursuit of justice, determined to protect his loved ones.","['Action', 'Thriller', 'Mystery']",66.4616,6.768,95,en,2025-11-13
1247002,The Old Woman with the Knife,"Aging assassin Hornclaw has seen it all, but she never expected to mentor a reckless rookie like Bullfight. As their unlikely bond deepens, cracks form in the underworld they navigate together. When Hornclaw discovers someone wants her dead, she's thrust into a deadly game of deception. With enemies closing in and trust in short supply, survival means staying sharp—both blade and mind.","['Action', 'Mystery', 'Drama']",62.0582,6.5,49,ko,2025-04-30
533533,TRON: Ares,"A highly sophisticated Program called Ares is sent from the digital world into the real world on a dangerous mission, marking humankind's first encounter with A.I. beings.","['Science Fiction', 'Adventure', 'Action']",61.7478,6.519,1052,en,2025-10-08
24428,The Avengers,"When an unexpected enemy emerges and threatens global safety and security, Nick Fury, director of the international peacekeeping agency known as S.H.I.E.L.D., finds himself in need of a team to pull the world back from the brink of disaster. Spanning the globe, a daring recruitment effort begins!","['Science Fiction', 'Action', 'Adventure']",65.472,7.912,35223,en,2012-04-25
803796,KPop Demon Hunters,"When K-pop superstars Rumi, Mira and Zoey aren't selling out stadiums, they're using their secret powers to protect their fans from supernatural threats.","['Fantasy', 'Music', 'Comedy', 'Animation']",58.7644,8.12,2251,en,2025-06-20
76600,Avatar: The Way of Water,"Set more than a decade after the events of the first film, learn the story of the Sully family (Jake, Neytiri, and their kids), the trouble that follows them, the lengths they go to keep each other safe, the battles they fight to stay alive, and the tragedies they endure.","['Action', 'Adventure', 'Science Fiction']",56.4106,7.602,13560,en,2022-12-14
1223601,Sisu: Road to Revenge,"Returning to the house where his family was brutally murdered during the war, ""the man who refuses to die"" dismantles it, loads it on a truck, and is determined to rebuild it somewhere safe in their honor. When the commander who killed his family comes back hellbent on finishing the job, a relentless, eye-popping cross-country chase ensues.","['Action', 'War']",57.8439,7.417,475,fi,2025-10-21
1196067,Worldbreaker,"Five years ago, a tear in the fabric of reality brought creatures to our world from an alternate dimension bent on our destruction. A father hides his daughter on an island to keep her safe while he prepares her for survival and the battles to come. But when the world is about to break, no place is safe.","['Science Fiction', 'Action', 'Horror']",56.0879,6.3,58,en,2025-10-30
1317288,Marty Supreme,"In 1950s New York, table tennis player Marty Mauser, a young man with a dream no one respects, goes to Hell and back in pursuit of greatness.",['Drama'],54.4757,8.1,143,en,2025-12-19
639988,No Other Choice,"After being laid off and humiliated by a ruthless job market, a veteran paper mill manager descends into violence in a desperate bid to reclaim his dignity.","['Crime', 'Thriller', 'Comedy']",51.7361,7.761,473,ko,2025-09-24
1205229,Night of the Zoopocalypse,A wolf and mountain lion team up when a meteor unleashes a virus turning zoo animals into zombies. They join forces with other survivors to rescue the zoo and stop the deranged mutant leader from spreading the virus.,"['Animation', 'Comedy', 'Horror', 'Adventure', 'Science Fiction']",50.9975,6.6,70,en,2025-01-23
1234731,Anaconda,"A group of friends facing mid-life crises head to the rainforest with the intention of remaking their favorite movie from their youth, only to find themselves in a fight for their lives against natural disasters, giant snakes and violent criminals.","['Adventure', 'Comedy', 'Horror']",52.3629,5.961,165,en,2025-12-24
840464,Greenland 2: Migration,"Having found the safety of the Greenland bunker after the comet Clarke decimated the Earth, the Garrity family must now risk everything to embark on a perilous journey across the wasteland of Europe to find a new home.","['Action', 'Adventure', 'Thriller', 'Science Fiction']",55.2276,6.6,64,en,2026-01-07
19995,Avatar,"In the 22nd century, a paraplegic Marine is dispatched to the moon Pandora on a unique mission, but becomes torn between following orders and protecting an alien civilization.","['Action', 'Adventure', 'Fantasy', 'Science Fiction']",51.2162,7.6,33290,en,2009-12-16
1539104,JUJUTSU KAISEN: Execution,"A veil abruptly descends over the busy Shibuya area amid the bustling Halloween crowds, trapping countless civilians inside. Satoru Gojo, the strongest jujutsu sorcerer, steps into the chaos. But lying in wait are curse users and spirits scheming to seal him away. Yuji Itadori, accompanied by his classmates and other top-tier jujutsu sorcerers, enters the fray in an unprecedented clash of curses — the Shibuya Incident. In the aftermath, ten colonies across Japan are transformed into dens of curses in a plan orchestrated by Noritoshi Kamo. As the deadly Culling Game starts, Special Grade sorcerer Yuta Okkotsu is assigned to carry out Yuji's execution for his perceived crimes. A compilation movie of Shibuya Incident including the first two episodes of the Culling Games arc.","['Animation', 'Action']",50.129,5.6,78,ja,2025-11-07
1471345,Homo Argentum,"The film consists of 16 shorts that explore, with humor and social criticism, the characteristics of the Argentine identity.",['Comedy'],50.1516,5.549,41,es,2025-08-14
798645,The Running Man,"Desperate to save his sick daughter, working-class Ben Richards is convinced by The Running Man's charming but ruthless producer to enter the deadly competition game as a last resort. But Ben's defiance, instincts, and grit turn him into an unexpected fan favorite — and a threat to the entire system. As ratings skyrocket, so does the danger, and Ben must outwit not just the Hunters, but a nation addicted to watching him fall.","['Action', 'Thriller', 'Science Fiction']",49.8054,6.794,1019,en,2025-11-11
1366745,Papá x dos,"Santiago decides to start a family with his girlfriend Ana, even though she is pregnant with her ex, Pancho's. However, the real challenge will come when Pancho unexpectedly returns from Miami to get involved in the pregnancy, unleashing a series of comical and chaotic situations in his home.","['Family', 'Comedy', 'Romance']",53.6204,4.2,9,es,2025-09-18
1195518,The Unholy Trinity,"Set against the turbulent backdrop of 1870s Montana, in the moments before the execution of Isaac Broadway, he gives his estranged son, Henry, an impossible task: murder the man who framed him for a crime he didn’t commit. Intent on fulfilling his promise, Henry travels to the remote town of Trinity, where an unexpected turn of events traps him in town and leaves him caught between Gabriel Dove, the town’s upstanding new sheriff, and a mysterious figure named St. Christopher.","['Western', 'Adventure', 'Crime']",51.671,6.4,136,en,2025-06-13
1233413,Sinners,"Trying to leave their troubled lives behind, twin brothers return to their hometown to start again, only to discover that an even greater evil is waiting to welcome them back.","['Horror', 'Action', 'Thriller']",50.1721,7.498,3253,en,2025-04-16
1013446,Reflection in a Dead Diamond,"When the mysterious woman in the room next door disappears, a debonair 70-year-old ex-spy living in a luxury hotel on the Côte d'Azur is confronted by the demons and darlings of a lurid past in which moviemaking, memories and madness collide.","['Action', 'Thriller', 'Mystery']",45.9978,6.1,58,fr,2025-06-25
1062722,Frankenstein,"Dr. Victor Frankenstein, a brilliant but egotistical scientist, brings a creature to life in a monstrous experiment that ultimately leads to the undoing of both the creator and his tragic creation.","['Drama', 'Fantasy', 'Horror']",46.3365,7.699,2671,en,2025-10-17
1432046,남친깨기전에빨리빼!,,[],45.8299,0.0,0,ko,2021-03-07
1336189,Delivery Run,"A food delivery driver gets caught in a deadly chase in the icy Minnesota wilderness, pursued by a crazed snowplow driver for unknown reasons, facing life-threatening situations and forced to outsmart his relentless pursuer alone.","['Action', 'Thriller']",46.3918,5.773,33,en,2025-09-10
1445698,The Pearl Comb,"A doctor, hell-bent on proving a woman’s place is in the home and not practising medicine, is sent to investigate her miraculous claim - only to discover the source of her unearthly power...",['Horror'],44.0455,7.5,3,en,2025-03-06
1218925,Chainsaw Man - The Movie: Reze Arc,"In a brutal war between devils, hunters, and secret enemies, a mysterious girl named Reze has stepped into Denji's world, and he faces his deadliest battle yet, fueled by love in a world where survival knows no rules.","['Animation', 'Action', 'Romance', 'Fantasy']",44.647,8.3,623,ja,2025-09-19
157336,Interstellar,The adventures of a group of explorers who make use of a newly discovered wormhole to surpass the limitations on human space travel and conquer the vast distances involved in an interstellar voyage.,"['Adventure', 'Drama', 'Science Fiction']",50.0813,8.466,38660,en,2014-11-05
1371185,Song Sung Blue,"Based on a true story, two down-on-their-luck musicians form a joyous Neil Diamond tribute band, proving it's never too late to find love and follow your dreams.","['Drama', 'Music', 'Romance']",38.0515,7.733,75,en,2025-12-25
1387382,Hunting Season,"When a reclusive survivalist and his daughter rescue a mysterious, wounded woman from a river, they become entangled in a deadly web of violence and revenge, forcing them to confront a brutal criminal to survive.","['Action', 'Drama', 'Thriller']",46.0562,7.1,114,en,2025-12-05
1033462,Bureau 749,A traumatized young man with physical abnormalities is forced to join a mysterious bureau to confront a disaster spreading across the earth caused by an unknown creature. He embarks on an adventure uncovering mysteries about his life.,"['Action', 'Adventure', 'Science Fiction']",39.6608,6.287,75,zh,2024-10-01
575265,Mission: Impossible - The Final Reckoning,"Ethan Hunt and team continue their search for the terrifying AI known as the Entity — which has infiltrated intelligence networks all over the globe — with the world's governments and a mysterious ghost from Hunt's past on their trail. Joined by new allies and armed with the means to shut the Entity down for good, Hunt is in a race against time to prevent the world as we know it from changing forever.","['Action', 'Thriller', 'Adventure']",45.1604,7.201,2442,en,2025-05-17
1327881,Voice of Shadows,A young working class woman stands to inherit an estate if she and her boyfriend abide by a set of bizarre stipulations.,"['Horror', 'Mystery', 'Thriller']",38.8667,4.6,13,en,2024-09-17
1315303,Primate,"Lucy, a college student, along with her friends, spend their vacation at her family's home in Hawaii, which includes her pet chimpanzee, Ben. However, when Ben contracts rabies after being bitten by a rabid animal, the group must fight for their lives in order to avoid the now-violent chimp.","['Horror', 'Thriller']",39.9122,6.6,37,en,2026-01-01
447273,Snow White,"Following the benevolent King's disappearance, the Evil Queen dominated the once fair land with a cruel streak. Princess Snow White flees the castle when the Queen, in her jealousy over Snow White's inner beauty, tries to kill her. Deep into the dark woods, she stumbles upon seven magical dwarves and a young bandit named Jonathan. Together, they strive to survive the Queen's relentless pursuit and aspire to take back the kingdom.","['Family', 'Fantasy']",41.0762,4.296,1515,en,2025-03-19
980477,Ne Zha 2,"After a catastrophic event leaves their bodies destroyed, Ne Zha and Ao Bing are granted a fragile second chance at life. As tensions rise between the dragon clans and celestial forces, the two must undergo a series of perilous trials that will test their bond, challenge their identities, and decide the fate of both mortals and immortals.","['Animation', 'Fantasy', 'Adventure', 'Action']",40.0825,8.123,557,zh,2025-01-29
911430,F1,Racing legend Sonny Hayes is coaxed out of retirement to lead a struggling Formula 1 team—and mentor a young hotshot driver—while chasing one more chance at glory.,"['Action', 'Drama']",38.6237,7.801,3114,en,2025-06-25
1100988,28 Years Later,"Twenty-eight years after the Rage virus outbreak, Britain remains sealed off from the world. A fortified island community survives in isolation—until a young boy’s journey to the mainland reveals how both the infected and the survivors have evolved.","['Horror', 'Thriller', 'Science Fiction']",40.7633,6.632,2057,en,2025-06-18
1234821,Jurassic World Rebirth,"Five years after the events of Jurassic World Dominion, covert operations expert Zora Bennett is contracted to lead a skilled team on a top-secret mission to secure genetic material from the world's three most massive dinosaurs. When Zora's operation intersects with a civilian family whose boating expedition was capsized, they all find themselves stranded on an island where they come face-to-face with a sinister, shocking discovery that's been hidden from the world for decades.","['Science Fiction', 'Adventure', 'Action']",39.6283,6.344,2847,en,2025-07-01
772462,Don't Follow Me,"Obsessed with going viral with her videos of ghosts and paranormal events, aspiring influencer Carla moves into a famous haunted building. There, she begins faking ghostly apparitions to gain more followers, unaware that a real evil entity resides in her apartment and will torment her until no one, not even she, can distinguish what's real and what isn't.","['Horror', 'Mystery']",37.6908,6.353,34,es,2025-10-30
