tmdb_id,title,overview,genres,popularity,vote_average,vote_count,language,release_date
950396,The Gorge,"Two highly trained operatives grow close from a distance after being sent to guard opposite sides of a mysterious gorge. When an evil below emerges, they must work together to survive what lies within.","['Romance', 'Science Fiction', 'Thriller']",38.3032,7.648,3345,en,2025-02-13
1087192,How to Train Your Dragon,"On the rugged isle of Berk, where Vikings and dragons have been bitter enemies for generations, Hiccup stands apart, defying centuries of tradition when he befriends Toothless, a feared Night Fury dragon. Their unlikely bond reveals the true nature of dragons, challenging the very foundations of Viking society.","['Fantasy', 'Family', 'Action', 'Adventure']",38.544,7.957,2491,en,2025-06-06
1530875,All the Devils Are Here,"After a heist, four criminals lay low in a remote safehouse, waiting for orders. As paranoia builds, one thing becomes clear — the real threat may not be outside, but among them.","['Thriller', 'Crime', 'Drama', 'Mystery']",35.8953,6.1,51,en,2025-09-25
269149,Zootopia,"Determined to prove herself, Officer Judy Hopps, the first bunny on Zootopia's police force, jumps at the chance to crack her first case - even if it means partnering with scam-artist fox Nick Wilde to solve the mystery.","['Animation', 'Adventure', 'Family', 'Comedy']",38.6528,7.758,17531,en,2016-02-11
967941,Wicked: For Good,"As an angry mob rises against the Wicked Witch, Glinda and Elphaba will need to come together one final time. With their singular friendship now the fulcrum of their futures, they will need to truly see each other, with honesty and empathy, if they are to change themselves, and all of Oz, for good.","['Fantasy', 'Adventure', 'Romance']",35.0226,6.714,734,en,2025-11-19
1083637,Kantara - A Legend: Chapter 1,"During the Kadamba reign, King Vijayendra, the ruler of the fictional feudatory land of Bangra, meets his final fate while venturing into the mystical forest of Kantara. Witnessing this, his son Rajashekara seals the borders of their realm. Later, Prince Kulashekara reopens them through a brutal massacre. The protagonist, Berme, in search of prosperity, crosses the divide and ignites a conflict of faith, power, and destiny between the Kingdom and Nature.","['Action', 'Drama', 'Fantasy']",33.9835,7.017,58,kn,2025-10-01
1220564,The Secret Agent,"Brazil, 1977. Marcelo, a technology expert in his early 40s, is on the run. Hoping to reunite with his son, he travels to Recife during Carnival but soon realizes that the city is not the safe haven he was expecting.","['Crime', 'Drama', 'Thriller']",45.0159,7.722,178,pt,2025-07-23
1448560,Wildcat,An ex-black ops team reunite to pull off a desperate heist in order to save the life of their leader’s eight-year-old daughter.,"['Action', 'Thriller', 'Crime']",36.0071,5.965,71,en,2025-11-19
1422096,Good Boy,"A loyal dog moves to a rural family home with his owner Todd, only to discover supernatural forces lurking in the shadows. As dark entities threaten his human companion, the brave pup must fight to protect the one he loves most.",['Horror'],37.3393,6.739,474,en,2025-10-01
1403735,Laila,"Sonu Model, a renowned beautician from the old city, is forced to disguise himself as Laila, leading to a series of comedic, romantic, and action-packed events. Chaos ensues in this hilarious laugh riot","['Comedy', 'Romance']",33.8834,5.2,6,te,2025-02-14
238,The Godfather,"Spanning the years 1945 to 1955, a chronicle of the fictional Italian-American Corleone crime family. When organized crime family patriarch, Vito Corleone barely survives an attempt on his life, his youngest son, Michael steps in to take care of the would-be killers, launching a campaign of bloody revenge.","['Drama', 'Crime']",35.1703,8.687,22324,en,1972-03-14
1246049,Dracula,"When a 15th-century prince denounces God after the devastating loss of his wife, he inherits an eternal curse: he becomes Dracula. Condemned to wander the centuries, he defies fate and death itself, guided by a single hope — to be reunited with his lost love.","['Horror', 'Fantasy', 'Romance']",35.3407,7.173,753,fr,2025-07-30
617126,The Fantastic 4: First Steps,"Against the vibrant backdrop of a 1960s-inspired, retro-futuristic world, Marvel's First Family is forced to balance their roles as heroes with the strength of their family bond, while defending Earth from a ravenous space god called Galactus and his enigmatic Herald, Silver Surfer.","['Science Fiction', 'Adventure', 'Action']",34.948,6.987,2864,en,2025-07-23
550,Fight Club,"A ticking-time-bomb insomniac and a slippery soap salesman channel primal male aggression into a shocking new form of therapy. Their concept catches on, with underground ""fight clubs"" forming in every town, until an eccentric gets in the way and ignites an out-of-control spiral toward oblivion.","['Drama', 'Thriller']",28.1498,8.438,31278,en,1999-10-15
1010581,My Fault,"Noah must leave her city, boyfriend, and friends to move into William Leister's mansion, the flashy and wealthy husband of her mother Rafaela. As a proud and independent 17 year old, Noah resists living in a mansion surrounded by luxury. However, it is there where she meets Nick, her new stepbrother, and the clash of their strong personalities becomes evident from the very beginning.","['Drama', 'Romance', 'Thriller']",34.0115,7.761,3974,es,2023-06-08
1061474,Superman,"Superman, a journalist in Metropolis, embarks on a journey to reconcile his Kryptonian heritage with his human upbringing as Clark Kent.","['Science Fiction', 'Adventure', 'Action']",35.0544,7.383,4183,en,2025-07-09
1584215,The Internship,"A CIA-trained assassin recruits other graduates from her secret childhood program, The Internship, to violently destroy the organization. The CIA fights back with deadly force.",['Action'],29.4137,6.446,28,en,2026-01-13
1116465,A Legend,An archeologist noticed that the texture of the relics discovered during the excavation of a glacier closely resembled a jade pendant seen in one of his dreams. He and his team then embark on an expedition into the depths of the glacier.,"['Action', 'Adventure', 'Fantasy']",35.1099,6.843,137,zh,2024-07-05
1180831,Troll 2,"When a dangerous new troll unleashes devastation across their homeland, Nora, Andreas and Major Kris embark on their most perilous mission yet.","['Action', 'Fantasy', 'Thriller']",32.6532,6.563,365,no,2025-11-30
1266990,Kulong,"Three friends retreat to a resort to collaborate on a daring screenplay for a contest. Faced with the challenge of writing about passion despite their own dry spells, their journey soon blurs the line between imagination and experience.",['Drama'],33.4412,6.0,7,tl,2024-05-24
812583,Wake Up Dead Man: A Knives Out Mystery,"When young priest Jud Duplenticy is sent to assist charismatic firebrand Monsignor Jefferson Wicks, it’s clear that all is not well in the pews. After a sudden and seemingly impossible murder rocks the town, the lack of an obvious suspect prompts local police chief Geraldine Scott to join forces with renowned detective Benoit Blanc to unravel a mystery that defies all logic.","['Thriller', 'Mystery', 'Comedy']",30.3399,7.216,1833,en,2025-11-26
991494,The SpongeBob Movie: Search for SquarePants,"Desperate to be a big guy, SpongeBob sets out to prove his bravery to Mr. Krabs by following The Flying Dutchman – a mysterious swashbuckling ghost pirate – on a seafaring adventure that takes him to the deepest depths of the deep sea, where no Sponge has gone before.","['Animation', 'Family', 'Comedy', 'Adventure', 'Fantasy']",52.5488,6.493,73,en,2025-12-16
1211442,Rebuilding,"After wildfires take his ranch, a cowboy named Dusty winds up in a FEMA camp, finding community with others who lost homes, including his daughter and ex-wife.",['Drama'],27.0115,6.9,27,en,2025-11-14
1363123,The Family Plan 2,"Now that Dan's assassin days are behind him, all he wants for Christmas is quality time with his kids. But when he learns his daughter has her own plans, he books a family trip to London—putting them all in the crosshairs of an unexpected enemy.","['Action', 'Comedy']",31.8812,6.6,461,en,2025-11-11
1408208,Exit 8,"A man gets lost in an underground passage. He follows the ""guide"" through the passage, but one after another, strange things happen to him. Is this space real? Or an illusion? Will the man be able to escape the passage?","['Horror', 'Mystery', 'Thriller']",29.8866,6.171,114,ja,2025-08-28
62201,Shahenshah,"Inspector Srivastav is framed by a wily and cunning gangster, J.K., and unable to prove his innocence, hangs himself, leaving behind his wife, and son, Vijay. Years later, Vijay has grown up and has joined the police force as an Inspector. Unlike his dad, he is corrupt and does accept bribes to turn a nelson's eye to crime. The City Police are assigned the task of apprehending a customed man called ""Shahenshah"", who operates at night and targets, tries and kills gangsters in a ""Judge and Executioner ""style. No one knows the real identity of Shahenshah, as he is feared by the police department, and respected by the poor and middle-class.",['Action'],32.2459,6.4,26,hi,1988-01-29
1255718,Plainclothes,"In 1990s New York, an undercover police officer receives an assignment to lure and arrest gay men. However, he's surprised to discover a scintillating connection with one of his targets. As their secret connection deepens and internal pressure to deliver arrests intensifies, he finds himself torn between duty and desire.","['Drama', 'Romance', 'Crime']",30.0804,7.314,43,en,2025-01-26
1197137,Black Phone 2,"Four years after escaping The Grabber, Finney Blake is struggling with his life after captivity. When his sister Gwen begins receiving calls in her dreams from the black phone and seeing disturbing visions of three boys being stalked at a winter camp, the siblings become determined to solve the mystery and confront a killer who has grown more powerful in death and more significant to them than either could imagine.","['Horror', 'Thriller']",28.0894,6.795,839,en,2025-10-15
1090983,The Beldham,"At the edge of postpartum psychosis, new mother Harper moves in with her own mother at their family's rural farmhouse. Soon she finds herself hunted by a threatening monster who has designs on her child.",['Horror'],26.037,5.455,22,en,2025-11-07
1236153,Mercy,"In the near future, a detective stands on trial accused of murdering his wife. He has 90 minutes to prove his innocence to the advanced AI Judge he once championed, before it determines his fate.","['Science Fiction', 'Action', 'Thriller']",29.9387,6.8,5,en,2026-01-19
